"Redução das taxas de IRC , começando com a redução gradual de 2 pontos percentuais por ano até aos 15% no final da Legislatura. Esta redução deverá acompanhar a transposição para a ordem jurídica nacional dos trabalhos em curso, ao nível da OCDE e da UE, relativas à garantia de um nível mínimo mundial de tributação para os grupos de empresas multinacionais e grandes grupos nacionais na União, que se destina a assegurar a tributação efetiva dos lucros a uma taxa de A derrama municipal e a sua distribuição por município têm escassa eficácia e produzem efeitos perniciosos na eficiência e transparência. Deve, assim, caminhar-se no sentido de eliminar, de forma gradual, a progressividade da derrama  estadual, e de eliminar a derrama municipal em sede de IRC;"
"Eliminação de constrangimentos à realização de reorganizações societárias e de benefícios em função da dimensão, através do aperfeiçoamento de clarificação do regime legal e fiscal aplicável às reorganizações empresariais. No caso de cisões e/ou reorganizações empresariais, evitando que o tratamento dos benefícios fiscais nas empresas resultantes seja um incentivo à inação.  Revisão dos custos fiscais associados a operações de aquisição e/ou fusão;"
"Revisão dos limites quantitativos ao reporte de prejuízos, e expansão das possibilidades de dedução total (sob a forma de custos) dos investimentos realizados, de modo a atenuar a tributação implícita sobre o reinvestimento  empresarial;"
"Criação do regime de Grupos de IVA que permita a consolidação das obrigações de IVA no contexto de um Grupo de sociedades;"
"Eliminar as medidas que prejudicam o financiamento das empresas portuguesas."
"Rever o regime geral das taxas que possa disciplinar e reduzir a criação de taxas pelas várias entidades das administrações públicas  (segundo alguns cálculos serão cerca de 4.300 as taxas atualmente existentes);"
"Fixar as diretrizes para uma política fiscal internacional ajustada às opções de política fiscal de Portugal, em especial no que diz respeito à renegociação dos tratados para eliminar a dupla tributação mais relevantes e à celebração de novos convénios para eliminar a dupla tributação com parceiros-chave (por exemplo, Austrália, Singapura, Nova Zelândia). b. Simplificação e redução dos custos de cumprimento das obrigações declarativas, passando pela simplificação e racionalização das plataformas informáticas ao serviço da AT, em especial, as interfaces existentes no “Portal das Finanças”, a racionalização e redução da atitude litigante da AT, a promoção do cumprimento voluntário  das obrigações fiscais e a implementação de estratégias dirigidas a estimular a colaboração entre a AT e os contribuintes, sejam estes pessoas individuais ou coletivas;"
"c. Forte Simplificação fiscal, eliminando exceções, regimes especiais e incentivos fiscais dispersos (em particular os que dependem de condições não observáveis ou inverificáveis) em todos os códigos tributários, reduzindo assim a ineficiência e complexidade, diminuindo também os custos de cumprimento das obrigações fiscais pelos  agentes económicos, e melhorando a justiça redistributiva;"
"e. Reformular a justiça tributária , com o intuito de reduzir drasticamente a litigância e  as pendências em todos os tribunais tributários. Assim, propõe-se, em particular:"
"Aumentar a eficiência dos tribunais tributários, em termos humanos e materiais,  de forma a reduzir as pendências judiciais em matéria tributária;"
"A instalação de duas grandes câmaras tributárias para a decisão de processos de valor igual ou superior a 1 milhão de euros, dotando estes tribunais dos meios  humanos e materiais necessários a uma boa e atempada decisão destas causas;"
"Numa primeira fase, aumentar o limiar de vinculação da arbitragem tributária, bem como um levantamento dos entraves processuais ao recurso à arbitragem  fiscal;"
"Ponderar a criação de formas de processo simplificadas para a resolução de casos de menor valor;"
"Reforçar a celeridade e a eficácia dos pedidos de informação vinculativa, em particular os urgentes, eliminando a necessidade de justificar o caráter de urgência, bem como a possibilidade de escusa absoluta da AT em que estes pedidos tramitem sob a forma urgente. f. Reforma da AT,  para reforçar equilíbrio da relação com os contribuintes , a adequação dos sistemas de incentivos atuais (que poderão contribuir para a litigância), a articulação com a administração da segurança social, e o estímulo ao cumprimento  voluntário:"
"Reforçar a independência da AT face ao Governo, através da transformação da  AT numa Agência Tributária Independente;"
"Reforçar o combate à fraude e evasão fiscais, assegurando, ao mesmo tempo, maiores níveis de equidade fiscal e garantindo sempre os direitos dos contribuintes. Funcionalizar a utilização das tecnologias mais avançadas na gestão, em particular inteligência artificial, de um programa de combate à fraude e evasão fiscais, sem comprometer as garantias constitucionais dos contribuintes;     Implementação de um sistema de controlo do cumprimento tempestivo das decisões judiciais por parte da AT e de devolução célere dos impostos pagos que tenham sido anulados por decisões administrativas ou judiciais, e divulgação/publicação de forma autonomizada dos valores pagos anualmente em juros de  mora agravados."
"da segurança socialÉ objetivo da AD caminharmos para um sistema de Segurança Social que seja uma forte rede de segurança, caracterizada por clareza, previsibilidade e sustentabilidade em relação às contribuições e aos benefícios, que não perpetue a pobreza, nem represente  um desincentivo ao trabalho e à valorização profissional, nem impeça ou limite o envelhecimento ativo, com estabilidade e em segurança."
"Relativamente ao sistema de pensões, cuja sustentabilidade tem sido questionada, importa evitar a recorrência de debates públicos baseados em mistificações e promover uma discussão esclarecida e serena, num contexto de estabilidade e previsibilidade  das regras, contribuições e benefícios, durante a atual legislatura."
"A AD assume que as alterações estruturais demográficas na população portuguesa (envelhecimento, prolongamento da esperança de vida, baixa natalidade, alongamento do  ensino obrigatório e aumento da frequência do ensino superior) e na economia e atividade produtiva colocam sérios desafios ao sistema de pensões, que o país deve enfrentar."
"É necessária, porém, a existência de condições de debate e discussão racional, pelo que a AD assume que a legislatura iniciada em 2024 deve ser dedicada ao Estudo, com Análise e Discussão dos Desafios e Respostas para a Segurança Social, o qual deve ser o mais amplo possível, participado pela sociedade e por personalidades e instituições independentes, sereno, baseado em factos, e dirigido à construção de soluções que funcionem, preservem a sustentabilidade num quadro de equidade-intergeracional. O Estudo, com análise e eventual proposta de caminhos e soluções, deve permitir a sua adoção e implementação na legislatura seguinte. Durante a presente legislativa, a AD considera crítico, por não poder esperar, que a Segurança social dê uma resposta mais efetiva às situações economicamente mais frágeis, contribuindo decisivamente para retirar os portugueses com menores rendimentos da pobreza, tanto reformados como trabalhadores. Assim, a AD propõe o reforço do  Complemento Solidário para Idosos e a criação do Suplemento Remunerativo Solidário."
"o novo suplemento remunerativo solidário para combater  a pobreza entre trabalhadoresO sistema de Proteção Social deve estar focado em proporcionar uma efetiva pro-teção  a quem está mais vulnerável, promovendo o seu emprego  e a sua valorização profissional . Existe em Portugal uma armadilha de pobreza. A multiplicidade de compo -regras, dificulta o seu acesso ao cidadão mais vulnerável, e a previsibilidade do apoio público quando esta é mais necessária. As regras de retirada dos apoios sociais ignoram os riscos inerentes à entrada no mercado de trabalho, colocando o trabalhador no dilema de participar no mercado e perder apoios sociais, ou manter-se na inatividade . Este impacto pernicioso na participação no mercado e na valorização profissional tem de ser corrigido com vista a incentivar o trabalho e a assegurar a justiça social. Por princípio, quem participa no mercado de trabalho não deve ter rendimentos inferiores ao apoio público que teria se tivesse ficado  inativo."
"Hoje, quem tenha rendimentos baixos vê-lhe retirados diversos apoios sociais de forma repentina, caso ultrapasse em um euro determinados níveis de rendimento . Tal sucede porque os valores de inúmeros apoios sociais são indexados a escalões de rendimentos, por vezes definidos de forma ligeiramente diferente. Na transição entre escalões ocorre uma substancial perda de apoios, ou até mesmo a sua retirada total, o que resulta numa barreira efetiva a que estes trabalhadores procurem aumentar os seus rendimentos do trabalho ou se valorizem profissionalmente . São retirados sem exceções nem contemplações abonos de família, a ação social escolar, a isenção de taxas moderadoras na saúde, a tarifa social de eletricidade, a tarifa social de gás, a isenção de pagamento (ou a passagem para outro escalão) em escolas  em regime de IPSS (pré-escolar). Torna-se desta forma indesejável ser promovido ou procurar um emprego melhor."
"Para resolver esta situação, a AD propõe a criação de um Suplemento Remunerativo  Solidário com as seguintes características:"
"Simplificação do atual sistema pulvorizado de apoios sociais através da sua agregação económica;"
"Atribui a cada agregado familiar:"
"o valor das prestações sociais atualmente recebidas pelo agregado familiar;  um suplemento que garante que o aumento do rendimento do trabalho não conduz a uma perda de rendimento disponível."
"Elimina-se desta forma o absurdo sistema de escalões e descontinuidades, resultando num sistema de subsídio ao trabalho até determinado nível de rendimento , e taxas marginais de imposto relativamente baixas na fase de eliminação (gradual) do apoio, dependentes, para os trabalhadores que auferem baixos rendimentos, promovendo a sua integração e permanência no mercado de trabalho e mitigando o risco associado  aos seus rendimentos no contexto do mercado de trabalho."
"As famílias passam a receber uma transferência do Estado, que deverá ser antecipada mensalmente, através, por exemplo, da introdução de taxas de retenção negativas de  IRS para os rendimentos mais baixos."
"o reforço do complemento solidário para idosos  para combater a pobreza em idades mais avançadasEm 2022, cerca de 1,5 milhões de pensões têm um valor inferior ao salário mínimo, com uma pensão mínima mensal de cerca de 292€. O regime atual do Complemento Solidário para Idosos (CSI), reconhecendo a grande fragilidade de quem sem mais rendimento ou parco património recebe estes valores ou próximos, pouco faz para retirar estes reformados da pobreza. O CSI atribui um reforço de rendimentos médio de apenas 144€,  garantindo um valor de cerca de 489€ a 135 mil reformados."
"A AD considera não ser possível, sem mais rendimentos ou património, evitar a pobreza com este fraco apoio, e assim compromete-se a reforçar o Complemento Solidário para idosos, numa trajetória que garanta que os reformados em situações mais vulneráveis recebem um apoio efetivo da Segurança Social para viverem com dignidade. O reforço  do Complemento Solidário para Idosos tem as seguintes características:"
"Define-se uma trajetória de reforço do valor de referência do CSI para que em 2028  todos os reformados em situações de maior fragilidade tenham um valor de referência garantido de 820€;"
"Ajusta-se a condição de recursos de acesso do CSI em linha com a atualização do  valor de referência."
"reforma da gestão da segurança social Reforma da máquina administrativa da Segurança Social, que merece profunda modernização e transformação, de modo a gerir eficientemente todo o sistema de benefícios sociais, permitindo, por exemplo, a adequada contabilização de todos os apoios dispersos (incluindo em espécie) e a criação de contas individuais , que registem todos os movimentos e direitos relativos às medidas relacionadas com o mercado de trabalho e aos direitos constituídos em termos de pensão de reforma. É No plano organizacional, deve ser ponderada a aproximação ao modelo, sistema de incentivos e capacidade técnica operacional da Autoridade Tributária, com maior  interconexão entre ambas ou até a sua fusão ; neste caso, com segregação interna;"
"É necessário melhorar a relação com as Instituições Sociais (IPSS, Misericórdias, Mutualidades, entre outras) e privados com equipamentos sociais, que deve seguir um modelo contratualizado (em linha com os princípios preconizados nas Reformas do Estado), com fiscalização eficaz e garantia de provisão dos serviços em condições  dignas e humanizantes;"
"Importa melhorar o papel da gestão de ativos, seja preparando a Segurança Social pública para gerir fundos de capitalização de adesão voluntária, em competição com  o setor privado e mutualista."
"Iniciativa Privada  e na Produtividade menores custos de contexto: Um mercado de bens e serviços mais concorrencial e dinâmico é fundamental para proporcionar a consumidores e empresas maior qualidade a preços mais baixos. A AD pugnará por esta visão, num contexto em que há evidência abundante de limitações à concorrência e à livre entrada em diversos setores (incluindo profissões), rendas excessivas e incapacidade dos Reguladores. A complexidade regulatória é vasta, persistindo uma  enorme incerteza na aplicação da regulação e na aprovação de projetos industriais, comerciais, agrícolas ou urbanísticos."
"O ambiente de negócios em Portugal degradou-se nos últimos anos. Portugal passou de 24ª economia mundial com melhor ambiente de negócios para as empresas em 2015 para 39ª em 2023 (Doing Business, Banco Mundial). Para inverter esta degradação é importante que haja uma avaliação regular dos efeitos da legislação sobre a atividade das empresas, a simplificação da burocracia e o reforço da concorrência no mercado  nacional."
"medidas tendentes a eliminar barreiras e constrangimentos  à atividade económicaProceder ao levantamento e subsequente eliminação ou redução significativa das barreiras e constrangimentos à atividade económica  com o apoio das associações  setoriais. Priorizar setores já identificados como colocando maiores barreiras à entrada e à concorrência como sejam os Transportes (incluindo ferrovia), Energia e Comunicações;"
"Promover a simplificação geral dos processos administrativos e licenciamentos nas diferentes áreas para os cidadãos e empresas . Fazer avaliações regulares da  execução dos mecanismos de simplificação de licenciamento existentes (por exemplo licenciamento urbanístico) e futuros;"
"workflow dos processos administrativos e digitalização integral dos processos);"
"Aplicação de princípios de “only once”, proibindo entidades públicas de solicitarem  documentos e informações que estão na posse de outras entidades públicas ;"
"Evoluir para uma orientação geral de substituição do controlo prévio por fiscalização a posteriori . Nos regimes de controlo prévio, impor o deferimento tácito como regra geral, sustentado em termos de responsabilidade dos autores dos projetos, mas sem prescindir da responsabilização pública pelo silêncio ou omissão de análise; Criação de incentivos ao “aconselhamento para a aprovação”  (em vez da atitude  de “rejeição à partida” por receios de responsabilização por ilegalidade);"
"Consagrar o Ponto único de entrada para licenciamentos complexos (em vez de  submissão a múltiplas entidades)."
"Reforço da Regulação Económica Independente (da concorrência e setorial),  designadamente através de:"
"Robustecimento da independência das Entidades Reguladoras por :"
"Alteração das regras de designação para os órgãos de administração das entidades reguladoras envolvendo: Procedimento concursal internacional, potencialmente prevendo a nomeação de pelo menos um membro que seja cidadão estrangeiro não residente  em Portugal (à imagem do que já sucede no CFP);"
"Designação final pelo Presidente da República, sob proposta do Governo,  com audição prévia na Assembleia da República;"
"Requisitos robustos de conflitos de interesse, incluído período de nojo prévio à nomeação no qual os nomeados não podem ter desempenhado cargos de eleição ou nomeação política, incluindo em Governo (membros ou gabinetes  de apoio), Parlamento e órgãos de direção dos partidos políticos."
"Garantia da efetiva independência orgânica, funcional, técnica e financeira das entidades reguladoras, designadamente excluindo condicionamentos políticos como cativações orçamentais ou interferências nas políticas de recursos humanos;  Obrigatoriedade de formação dos membros da administração das entidades reguladoras em áreas como, por exemplo, a gestão de projetos e comunicação."
"Reforço da prestação de contas ( accountability ) e da avaliação e monitorização da atividade das Entidades Reguladoras e análise de Impacto regulatório (AIR), incluindo exigência de desenvolvimento de um barómetro de avaliação das entidades reguladoras, com indicadores agregados de medidas de independência,  transparência, desempenho e governança; e obrigatoriedade de publicação, na página da internet de cada entidade reguladora, do plano de atividades, com nível e detalhe e objetivos  que permitam a sua avaliação e do relatório de regulação;"
"Garantia de uniformidade e especialização no controlo jurisdicional das entidades  reguladoras, designadamente com:"
"Criação de um Regime Único de Contraordenações das Autoridades Reguladoras; Atribuição de efetivos poderes de intervenção processual a todas as Autoridades  Reguladoras;"
"Fortalecimento do Tribunal da Concorrência, Regulação e Supervisão, com criação de quadros de assessores judiciais e assessores económicos, alargamento da  jurisdição, ajustamento das regras de seleção dos respetivos magistrados judiciais para garantir efetiva especialização e exercício efetivo de funções, e implementação da base de dados das respetivas sentenças e decisões."
"Reforço e melhoria do envolvimento das partes interessadas nos procedimentos regulatórios, incluindo sistematização de mecanismos de participação e consulta, dever de fundamentação e resposta especificada às participações dos interessados,  equalização da representação dos diferentes interesses, e transparência e prevenção da captura regulatória;"
"Ampliação de competências e do âmbito de atuação dos reguladores às recentes  exigências da regulação digital, inteligência artificial, cripto-ativos e ESG."
"Evoluir ainda mais (não obstante as medidas recentes aprovadas por pressão europeia) na liberalização do acesso a profissões, impondo o princípio de inexistência de  conflito de interesses nas entidades que regulam o acesso às profissões."
"Aplicação efetiva, aceleração e automatização da compensação de créditos tributários;"
"Implementar, até ao final da legislatura, no âmbito de toda a Administração Pública,  a Conta-Corrente de empresas com o Estado;"
"Iniciar esforços junto da Comissão Europeia por forma a alargar o regime de IVA de Caixa existente dos atuais 500 mil € de faturação para 2 milhões (máximo permitido  pela Diretiva, sujeito a autorização da Comissão Europeia);"
"Eliminar Pagamentos em Atraso do Estado às Empresas Fornecedoras de bens e serviços, implementando modelos de pagamento compulsório de faturas em certo  prazo; Garantir nas entidades públicas pagamento a 30 dias."
"Consagração da IES (reformulada) como meio privilegiado para o fornecimento  de toda a informação para fins estatísticos e fiscais pelas empresas."
"Apostar na promoção da Concorrência no Setor bancário , que passa pelo estudo criterioso e implementação de : restrições ao bundling  de produtos (ou a penalizações no spread  do Crédito a Empresas e Crédito à Habitação por não contratação de seguros e outros produtos; revisão dos seguros obrigatórios); promoção de acesso a fundos do  mercado monetário e a dívida pública de forma simples, permitindo um acesso mais generalizado a instrumentos muito líquidos e concorrentes dos depósitos bancários."
"Revogação de Medidas penalizadoras do Alojamento LocalEliminar de imediato a Contribuição Extraordinária sobre o Alojamento Local, a caducidade das licenças anteriores ao programa Mais Habitação, e revendo simultaneamente  as limitações legais impostas pelo Governo socialista."
"e reestruturação empresarial A participação no euro propiciou condições de financiamento nunca antes verificadas na economia portuguesa e resultou num significativo aumento do endividamento bancário das empresas.  A concentração do financiamento empresarial sob a forma de crédito bancário encerra riscos e não é característica de economias na fronteira da inovação, Este paradigma contribui também para a dificuldade de as empresas crescerem, de se capitalizarem, de atingirem escala, dimensão, de se internacionalizarem, e de exportarem. Em contextos de aumentos de taxas de juro, contribui ainda para maior dificuldade no acesso a financiamento em todos os estágios de maturidade das empresas. O capital público não é suficiente para fazer face aos desafios que a economia atravessa, sendo necessário mobilizar investidores nacionais e estrangeiros de modo que apostem na  economia portuguesa."
"Em primeiro lugar, e em linha com o Reforço dos mecanismos fiscais de capitalização das  empresas, é necessário avançar com:"
"Maior flexibilidade na aplicação e utilização dos diferentes instrumentos de apoio à capitalização e à recapitalização . Eliminar/minimizar custos relativos a comissões  taxas, emolumentos, escrituras, etc;"
"Apoiar o investimento em capital de risco, estudando a possibilidade de introduzir  instrumentos como:"
"Linha de coinvestimento para start-ups  e capital de risco : Criação de um fundo para investimento híbridos de capital (títulos convertíveis) disponíveis para fundos de capital de risco, aceleradoras, “business angels” e “corporate ventures” que pretendam reforçar o capital e assegurar uma almofada financeira para empresas em carteira, muitas vezes impossibilitadas de aceder ao crédito bancário  em condições acessíveis;"
"e/ou a criação de um fundo de fundos, a ser implementado até ao final da legislatura, financiado com fundos do PT 2030, que possa adquirir unidades de participação em fundos de venture capital, sejam já existentes, sejam novos fundos, desde que demonstrem a capacidade de encontrar financiamento privado. O Fundo poderá ter por objetivo adquirir Unidades de Participação em fundos orientados para empresas em fase de scale-up . Reforço dos fundos de capitalização das empresas : Reforço/criação de fundos imobiliários em conjunto com os bancos e proprietários, de modo que as empresas possam financiar a sua atividade através da entrega e arrendamento dos seus imóveis, com um prazo de recompra; Auditoria aos mais de 30 fundos de investimento e garantias geridos por entidades públicas  com especial destaque ao Fundo de Contra-Garantia Mútuo que, pela sua dimensão, representa um risco relevante para as contas públicas. Será dada priori -participações não-estratégicas do Estado.  Esta abordagem assegura uma gestão responsável e eficaz dos fundos, promove a transparência e liberta recursos públicos para co-investir com investidores privados em novos projetos estratégicos; Negociar com Comissão Europeia a eliminação da restrição das empresas detidas  por capital de risco em serem consideradas como PME . A lógica de grupo, nas empresas detidas por capital de risco, deve cingir-se à matéria fiscal das normas anti-abuso;"
"Eliminação das restrições/obstáculos injustificados ao acesso das empresas ao mercado de capitais, incluindo entrada em bolsa;"
"Eliminação das restrições/obstáculos injustificados a formas alternativas e inovadoras de financiamento ( fintech , fundos de reestruturação, modelos de entrada de  capital, quasi-capital etc.) preservando a segurança dos pequenos investidores."
"Dada a importância do financiamento bancário nas empresas portuguesas, justificam-se ainda medidas nesta área:"
"Linha de partilha de risco para PMEs , garantida pelo Estado Português e pela UE, através do reforço do programa InvestEU. Esta medida deverá facilitar o acesso das  empresas a financiamento, num montante total de €10,000 milhões em empréstimos;"
"Garantias de Portefólio para PME’s : Criar uma linha de garantias de portefólio (em parceria com o BEI) para PME’s sem restrições de elegibilidade quanto à natureza dos empréstimos. Contrariamente à atual linha, que é intermediada pela SPGM gerando atrasos nos processos de decisão, o processo de decisão desta garantia de  portefólio seria delegado nos bancos, com elevados ganhos de eficiência;"
